root@lamp-ubuntu-s-1vcpu-1gb-tor1-01:~# tcpdump -c 5 -i eth0
tcpdump: verbose output suppressed, use -v or -vv for full protocol decode
listening on eth0, link-type EN10MB (Ethernet), capture size 262144 bytes
22:44:40.092049 IP lamp-ubuntu-s-1vcpu-1gb-tor1-01.ssh > 142.187.29.131.52682: Flags [P.], seq 2291042711:2291042819, ack 3084468571, win 501, options [nop,nop,TS val 2288999336 ecr 2468878441], length 108
22:44:40.092189 IP lamp-ubuntu-s-1vcpu-1gb-tor1-01.ssh > 142.187.29.131.52682: Flags [P.], seq 108:144, ack 1, win 501, options [nop,nop,TS val 2288999336 ecr 2468878441], length 36
22:44:40.092277 IP lamp-ubuntu-s-1vcpu-1gb-tor1-01.ssh > 142.187.29.131.52682: Flags [P.], seq 144:252, ack 1, win 501, options [nop,nop,TS val 2288999337 ecr 2468878441], length 108
22:44:40.092431 IP lamp-ubuntu-s-1vcpu-1gb-tor1-01.ssh > 142.187.29.131.52682: Flags [P.], seq 252:288, ack 1, win 501, options [nop,nop,TS val 2288999337 ecr 2468878441], length 36
22:44:40.093716 IP lamp-ubuntu-s-1vcpu-1gb-tor1-01.50791 > 67.207.67.3.domain: 31662+ [1au] PTR? 131.29.187.142.in-addr.arpa. (56)
5 packets captured
45 packets received by filter
9 packets dropped by kernel