root@lamp-ubuntu-s-1vcpu-1gb-tor1-01:~# tcpdump -n -i eth0
tcpdump: verbose output suppressed, use -v or -vv for full protocol decode
listening on eth0, link-type EN10MB (Ethernet), capture size 262144 bytes
22:54:04.117409 IP 147.182.158.9.22 > 142.187.29.131.52682: Flags [P.], seq 2294785615:2294785723, ack 3084477775, win 501, options [nop,nop,TS val 2289563362 ecr 2469442468], length 108
22:54:04.117546 IP 147.182.158.9.22 > 142.187.29.131.52682: Flags [P.], seq 108:144, ack 1, win 501, options [nop,nop,TS val 2289563362 ecr 2469442468], length 36
22:54:04.117632 IP 147.182.158.9.22 > 142.187.29.131.52682: Flags [P.], seq 144:252, ack 1, win 501, options [nop,nop,TS val 2289563362 ecr 2469442468], length 108
22:54:04.117703 IP 147.182.158.9.22 > 142.187.29.131.52682: Flags [P.], seq 252:288, ack 1, win 501, options [nop,nop,TS val 2289563362 ecr 2469442468], length 36
22:54:04.117910 IP 147.182.158.9.22 > 142.187.29.131.52682: Flags [P.], seq 288:508, ack 1, win 501, options [nop,nop,TS val 2289563362 ecr 2469442468], length 220
22:54:04.117996 IP 147.182.158.9.22 > 142.187.29.131.52682: Flags [P.], seq 508:544, ack 1, win 501, options [nop,nop,TS val 2289563362 ecr 2469442468], length 36
22:54:04.118194 IP 147.182.158.9.22 > 142.187.29.131.52682: Flags [P.], seq 544:740, ack 1, win 501, options [nop,nop,TS val 2289563362 ecr 2469442468], length 196
22:54:04.118334 IP 147.182.158.9.22 > 142.187.29.131.52682: Flags [P.], seq 740:776, ack 1, win 501, options [nop,nop,TS val 2289563363 ecr 2469442468], length 36
22:54:04.118404 IP 147.182.158.9.22 > 142.187.29.131.52682: Flags [P.], seq 776:980, ack 1, win 501, options [nop,nop,TS val 2289563363 ecr 2469442468], length 204
22:54:04.139596 IP 142.187.29.131.52682 > 147.182.158.9.22: Flags [.], ack 0, win 3545, options [nop,nop,TS val 2469442499 ecr 2289563354], length 0
22:54:04.139687 IP 147.182.158.9.22 > 142.187.29.131.52682: Flags [P.], seq 980:2432, ack 1, win 501, options [nop,nop,TS val 2289563384 ecr 2469442499], length 1452
22:54:04.147697 IP 142.187.29.131.52682 > 147.182.158.9.22: Flags [.], ack 108, win 3545, options [nop,nop,TS val 2469442511 ecr 2289563362], length 0
22:54:04.147794 IP 147.182.158.9.22 > 142.187.29.131.52682: Flags [P.], seq 2432:2896, ack 1, win 501, options [nop,nop,TS val 2289563392 ecr 2469442511], length 464
22:54:04.148069 IP 142.187.29.131.52682 > 147.182.158.9.22: Flags [.], ack 144, win 3545, options [nop,nop,TS val 2469442511 ecr 2289563362], length 0
22:54:04.148069 IP 142.187.29.131.52682 > 147.182.158.9.22: Flags [.], ack 252, win 3545, options [nop,nop,TS val 2469442511 ecr 2289563362], length 0
22:54:04.148069 IP 142.187.29.131.52682 > 147.182.158.9.22: Flags [.], ack 288, win 3545, options [nop,nop,TS val 2469442511 ecr 2289563362], length 0
22:54:04.148134 IP 147.182.158.9.22 > 142.187.29.131.52682: Flags [P.], seq 2896:3084, ack 1, win 501, options [nop,nop,TS val 2289563392 ecr 2469442511], length 188
22:54:04.148282 IP 147.182.158.9.22 > 142.187.29.131.52682: Flags [P.], seq 3084:3120, ack 1, win 501, options [nop,nop,TS val 2289563393 ecr 2469442511], length 36
22:54:04.148400 IP 147.182.158.9.22 > 142.187.29.131.52682: Flags [P.], seq 3120:3324, ack 1, win 501, options [nop,nop,TS val 2289563393 ecr 2469442511], length 204
22:54:04.148493 IP 147.182.158.9.22 > 142.187.29.131.52682: Flags [P.], seq 3324:3360, ack 1, win 501, options [nop,nop,TS val 2289563393 ecr 2469442511], length 36
22:54:04.148621 IP 147.182.158.9.22 > 142.187.29.131.52682: Flags [P.], seq 3360:3548, ack 1, win 501, options [nop,nop,TS val 2289563393 ecr 2469442511], length 188
22:54:04.148727 IP 147.182.158.9.22 > 142.187.29.131.52682: Flags [P.], seq 3548:3584, ack 1, win 501, options [nop,nop,TS val 2289563393 ecr 2469442511], length 36
22:54:04.148877 IP 147.182.158.9.22 > 142.187.29.131.52682: Flags [P.], seq 3584:3772, ack 1, win 501, options [nop,nop,TS val 2289563393 ecr 2469442511], length 188
22:54:04.152706 IP 142.187.29.131.52682 > 147.182.158.9.22: Flags [.], ack 508, win 3544, options [nop,nop,TS val 2469442511 ecr 2289563362], length 0
22:54:04.152707 IP 142.187.29.131.52682 > 147.182.158.9.22: Flags [.], ack 544, win 3544, options [nop,nop,TS val 2469442511 ecr 2289563362], length 0
22:54:04.152707 IP 142.187.29.131.52682 > 147.182.158.9.22: Flags [.], ack 740, win 3543, options [nop,nop,TS val 2469442511 ecr 2289563362], length 0
22:54:04.152765 IP 147.182.158.9.22 > 142.187.29.131.52682: Flags [P.], seq 3772:5712, ack 1, win 501, options [nop,nop,TS val 2289563397 ecr 2469442511], length 1940
22:54:04.153089 IP 147.182.158.9.22 > 142.187.29.131.52682: Flags [P.], seq 5712:5900, ack 1, win 501, options [nop,nop,TS val 2289563397 ecr 2469442511], length 188
22:54:04.153187 IP 142.187.29.131.52682 > 147.182.158.9.22: Flags [.], ack 776, win 3543, options [nop,nop,TS val 2469442511 ecr 2289563363], length 0
22:54:04.153187 IP 142.187.29.131.52682 > 147.182.158.9.22: Flags [.], ack 980, win 3542, options [nop,nop,TS val 2469442511 ecr 2289563363], length 0
22:54:04.153263 IP 147.182.158.9.22 > 142.187.29.131.52682: Flags [P.], seq 5900:5936, ack 1, win 501, options [nop,nop,TS val 2289563398 ecr 2469442511], length 36
22:54:04.153426 IP 147.182.158.9.22 > 142.187.29.131.52682: Flags [P.], seq 5936:6124, ack 1, win 501, options [nop,nop,TS val 2289563398 ecr 2469442511], length 188
22:54:04.154177 IP 147.182.158.9.22 > 142.187.29.131.52682: Flags [P.], seq 6124:7756, ack 1, win 501, options [nop,nop,TS val 2289563398 ecr 2469442511], length 1632
22:54:04.154305 IP 147.182.158.9.22 > 142.187.29.131.52682: Flags [P.], seq 7756:7792, ack 1, win 501, options [nop,nop,TS val 2289563399 ecr 2469442511], length 36
22:54:04.154371 IP 147.182.158.9.22 > 142.187.29.131.52682: Flags [P.], seq 7792:7996, ack 1, win 501, options [nop,nop,TS val 2289563399 ecr 2469442511], length 204
22:54:04.154498 IP 147.182.158.9.22 > 142.187.29.131.52682: Flags [P.], seq 7996:8032, ack 1, win 501, options [nop,nop,TS val 2289563399 ecr 2469442511], length 36
22:54:04.167085 IP 142.187.29.131.52682 > 147.182.158.9.22: Flags [.], ack 2388, win 3540, options [nop,nop,TS val 2469442530 ecr 2289563384], length 0
22:54:04.167178 IP 147.182.158.9.22 > 142.187.29.131.52682: Flags [P.], seq 8032:8752, ack 1, win 501, options [nop,nop,TS val 2289563411 ecr 2469442530], length 720
22:54:04.167467 IP 147.182.158.9.22 > 142.187.29.131.52682: Flags [P.], seq 8752:8940, ack 1, win 501, options [nop,nop,TS val 2289563412 ecr 2469442530], length 188
22:54:04.172923 IP 142.187.29.131.52682 > 147.182.158.9.22: Flags [.], ack 2432, win 3545, options [nop,nop,TS val 2469442535 ecr 2289563384], length 0
22:54:04.172998 IP 147.182.158.9.22 > 142.187.29.131.52682: Flags [P.], seq 8940:9456, ack 1, win 501, options [nop,nop,TS val 2289563417 ecr 2469442535], length 516
22:54:04.173263 IP 147.182.158.9.22 > 142.187.29.131.52682: Flags [P.], seq 9456:9644, ack 1, win 501, options [nop,nop,TS val 2289563418 ecr 2469442535], length 188
22:54:04.178202 IP 142.187.29.131.52682 > 147.182.158.9.22: Flags [.], ack 2896, win 3543, options [nop,nop,TS val 2469442541 ecr 2289563392], length 0
22:54:04.178202 IP 142.187.29.131.52682 > 147.182.158.9.22: Flags [.], ack 3084, win 3542, options [nop,nop,TS val 2469442541 ecr 2289563392], length 0
22:54:04.178202 IP 142.187.29.131.52682 > 147.182.158.9.22: Flags [.], ack 3120, win 3542, options [nop,nop,TS val 2469442541 ecr 2289563393], length 0
22:54:04.178309 IP 147.182.158.9.22 > 142.187.29.131.52682: Flags [P.], seq 9644:10160, ack 1, win 501, options [nop,nop,TS val 2289563423 ecr 2469442541], length 516
22:54:04.178598 IP 147.182.158.9.22 > 142.187.29.131.52682: Flags [P.], seq 10160:10348, ack 1, win 501, options [nop,nop,TS val 2289563423 ecr 2469442541], length 188
22:54:04.178780 IP 147.182.158.9.22 > 142.187.29.131.52682: Flags [P.], seq 10348:10572, ack 1, win 501, options [nop,nop,TS val 2289563423 ecr 2469442541], length 224
22:54:04.179542 IP 147.182.158.9.22 > 142.187.29.131.52682: Flags [P.], seq 10572:11552, ack 1, win 501, options [nop,nop,TS val 2289563424 ecr 2469442541], length 980
22:54:04.179700 IP 147.182.158.9.22 > 142.187.29.131.52682: Flags [P.], seq 11552:11756, ack 1, win 501, options [nop,nop,TS val 2289563424 ecr 2469442541], length 204
22:54:04.179792 IP 147.182.158.9.22 > 142.187.29.131.52682: Flags [P.], seq 11756:11792, ack 1, win 501, options [nop,nop,TS val 2289563424 ecr 2469442541], length 36
22:54:04.182831 IP 142.187.29.131.52682 > 147.182.158.9.22: Flags [.], ack 3324, win 3544, options [nop,nop,TS val 2469442543 ecr 2289563393], length 0
22:54:04.182831 IP 142.187.29.131.52682 > 147.182.158.9.22: Flags [.], ack 3772, win 3545, options [nop,nop,TS val 2469442543 ecr 2289563393], length 0
22:54:04.182895 IP 147.182.158.9.22 > 142.187.29.131.52682: Flags [P.], seq 11792:12272, ack 1, win 501, options [nop,nop,TS val 2289563427 ecr 2469442543], length 480
22:54:04.183234 IP 147.182.158.9.22 > 142.187.29.131.52682: Flags [P.], seq 12272:12924, ack 1, win 501, options [nop,nop,TS val 2289563427 ecr 2469442543], length 652
22:54:04.183531 IP 147.182.158.9.22 > 142.187.29.131.52682: Flags [P.], seq 12924:13200, ack 1, win 501, options [nop,nop,TS val 2289563428 ecr 2469442543], length 276
22:54:04.183660 IP 147.182.158.9.22 > 142.187.29.131.52682: Flags [P.], seq 13200:13404, ack 1, win 501, options [nop,nop,TS val 2289563428 ecr 2469442543], length 204
22:54:04.183771 IP 147.182.158.9.22 > 142.187.29.131.52682: Flags [P.], seq 13404:13440, ack 1, win 501, options [nop,nop,TS val 2289563428 ecr 2469442543], length 36
22:54:04.183885 IP 147.182.158.9.22 > 142.187.29.131.52682: Flags [P.], seq 13440:13644, ack 1, win 501, options [nop,nop,TS val 2289563428 ecr 2469442543], length 204
22:54:04.184289 IP 147.182.158.9.22 > 142.187.29.131.52682: Flags [P.], seq 13644:14160, ack 1, win 501, options [nop,nop,TS val 2289563429 ecr 2469442543], length 516
22:54:04.184562 IP 147.182.158.9.22 > 142.187.29.131.52682: Flags [P.], seq 14160:14400, ack 1, win 501, options [nop,nop,TS val 2289563429 ecr 2469442543], length 240
22:54:04.184811 IP 147.182.158.9.22 > 142.187.29.131.52682: Flags [P.], seq 14400:14640, ack 1, win 501, options [nop,nop,TS val 2289563429 ecr 2469442543], length 240
22:54:04.185052 IP 147.182.158.9.22 > 142.187.29.131.52682: Flags [P.], seq 14640:14880, ack 1, win 501, options [nop,nop,TS val 2289563429 ecr 2469442543], length 240
22:54:04.187912 IP 142.187.29.131.52682 > 147.182.158.9.22: Flags [.], ack 8032, win 3545, options [nop,nop,TS val 2469442548 ecr 2289563397], length 0
22:54:04.187973 IP 147.182.158.9.22 > 142.187.29.131.52682: Flags [P.], seq 14880:15120, ack 1, win 501, options [nop,nop,TS val 2289563432 ecr 2469442548], length 240
22:54:04.188143 IP 147.182.158.9.22 > 142.187.29.131.52682: Flags [P.], seq 15120:15308, ack 1, win 501, options [nop,nop,TS val 2289563432 ecr 2469442548], length 188
22:54:04.188252 IP 147.182.158.9.22 > 142.187.29.131.52682: Flags [P.], seq 15308:15344, ack 1, win 501, options [nop,nop,TS val 2289563433 ecr 2469442548], length 36
22:54:04.188389 IP 147.182.158.9.22 > 142.187.29.131.52682: Flags [P.], seq 15344:15548, ack 1, win 501, options [nop,nop,TS val 2289563433 ecr 2469442548], length 204
22:54:04.188493 IP 147.182.158.9.22 > 142.187.29.131.52682: Flags [P.], seq 15548:15584, ack 1, win 501, options [nop,nop,TS val 2289563433 ecr 2469442548], length 36
22:54:04.188631 IP 147.182.158.9.22 > 142.187.29.131.52682: Flags [P.], seq 15584:15788, ack 1, win 501, options [nop,nop,TS val 2289563433 ecr 2469442548], length 204
22:54:04.188738 IP 147.182.158.9.22 > 142.187.29.131.52682: Flags [P.], seq 15788:15824, ack 1, win 501, options [nop,nop,TS val 2289563433 ecr 2469442548], length 36
22:54:04.188866 IP 147.182.158.9.22 > 142.187.29.131.52682: Flags [P.], seq 15824:16028, ack 1, win 501, options [nop,nop,TS val 2289563433 ecr 2469442548], length 204
22:54:04.188992 IP 147.182.158.9.22 > 142.187.29.131.52682: Flags [P.], seq 16028:16064, ack 1, win 501, options [nop,nop,TS val 2289563433 ecr 2469442548], length 36
22:54:04.189164 IP 147.182.158.9.22 > 142.187.29.131.52682: Flags [P.], seq 16064:16268, ack 1, win 501, options [nop,nop,TS val 2289563433 ecr 2469442548], length 204
22:54:04.189326 IP 147.182.158.9.22 > 142.187.29.131.52682: Flags [P.], seq 16268:16304, ack 1, win 501, options [nop,nop,TS val 2289563434 ecr 2469442548], length 36
22:54:04.189457 IP 147.182.158.9.22 > 142.187.29.131.52682: Flags [P.], seq 16304:16508, ack 1, win 501, options [nop,nop,TS val 2289563434 ecr 2469442548], length 204
22:54:04.189563 IP 147.182.158.9.22 > 142.187.29.131.52682: Flags [P.], seq 16508:16544, ack 1, win 501, options [nop,nop,TS val 2289563434 ecr 2469442548], length 36
22:54:04.189691 IP 147.182.158.9.22 > 142.187.29.131.52682: Flags [P.], seq 16544:16748, ack 1, win 501, options [nop,nop,TS val 2289563434 ecr 2469442548], length 204
22:54:04.189788 IP 147.182.158.9.22 > 142.187.29.131.52682: Flags [P.], seq 16748:16784, ack 1, win 501, options [nop,nop,TS val 2289563434 ecr 2469442548], length 36
22:54:04.189910 IP 147.182.158.9.22 > 142.187.29.131.52682: Flags [P.], seq 16784:16988, ack 1, win 501, options [nop,nop,TS val 2289563434 ecr 2469442548], length 204
22:54:04.190016 IP 147.182.158.9.22 > 142.187.29.131.52682: Flags [P.], seq 16988:17024, ack 1, win 501, options [nop,nop,TS val 2289563434 ecr 2469442548], length 36
22:54:04.190149 IP 147.182.158.9.22 > 142.187.29.131.52682: Flags [P.], seq 17024:17228, ack 1, win 501, options [nop,nop,TS val 2289563434 ecr 2469442548], length 204
22:54:04.190260 IP 147.182.158.9.22 > 142.187.29.131.52682: Flags [P.], seq 17228:17264, ack 1, win 501, options [nop,nop,TS val 2289563435 ecr 2469442548], length 36
22:54:04.190457 IP 147.182.158.9.22 > 142.187.29.131.52682: Flags [P.], seq 17264:17972, ack 1, win 501, options [nop,nop,TS val 2289563435 ecr 2469442548], length 708
22:54:04.193145 IP 142.187.29.131.52682 > 147.182.158.9.22: Flags [.], ack 8752, win 3545, options [nop,nop,TS val 2469442557 ecr 2289563411], length 0
22:54:04.193200 IP 147.182.158.9.22 > 142.187.29.131.52682: Flags [P.], seq 17972:19468, ack 1, win 501, options [nop,nop,TS val 2289563437 ecr 2469442557], length 1496
22:54:04.197871 IP 142.187.29.131.52682 > 147.182.158.9.22: Flags [.], ack 8940, win 3545, options [nop,nop,TS val 2469442561 ecr 2289563412], length 0
22:54:04.197956 IP 147.182.158.9.22 > 142.187.29.131.52682: Flags [P.], seq 19468:19932, ack 1, win 501, options [nop,nop,TS val 2289563442 ecr 2469442561], length 464
22:54:04.198207 IP 147.182.158.9.22 > 142.187.29.131.52682: Flags [P.], seq 19932:20120, ack 1, win 501, options [nop,nop,TS val 2289563442 ecr 2469442561], length 188
22:54:04.204912 IP 142.187.29.131.52682 > 147.182.158.9.22: Flags [.], ack 9644, win 3545, options [nop,nop,TS val 2469442569 ecr 2289563417], length 0
22:54:04.204995 IP 147.182.158.9.22 > 142.187.29.131.52682: Flags [P.], seq 20120:20636, ack 1, win 501, options [nop,nop,TS val 2289563449 ecr 2469442569], length 516
22:54:04.205649 IP 147.182.158.9.22 > 142.187.29.131.52682: Flags [P.], seq 20636:20824, ack 1, win 501, options [nop,nop,TS val 2289563450 ecr 2469442569], length 188
22:54:04.205913 IP 147.182.158.9.22 > 142.187.29.131.52682: Flags [P.], seq 20824:21204, ack 1, win 501, options [nop,nop,TS val 2289563450 ecr 2469442569], length 380
22:54:04.206064 IP 147.182.158.9.22 > 142.187.29.131.52682: Flags [P.], seq 21204:21408, ack 1, win 501, options [nop,nop,TS val 2289563450 ecr 2469442569], length 204
22:54:04.207886 IP 142.187.29.131.52682 > 147.182.158.9.22: Flags [.], ack 13404, win 3545, options [nop,nop,TS val 2469442573 ecr 2289563423], length 0
22:54:04.207963 IP 147.182.158.9.22 > 142.187.29.131.52682: Flags [P.], seq 21408:21612, ack 1, win 501, options [nop,nop,TS val 2289563452 ecr 2469442573], length 204
22:54:04.208266 IP 147.182.158.9.22 > 142.187.29.131.52682: Flags [P.], seq 21612:21976, ack 1, win 501, options [nop,nop,TS val 2289563453 ecr 2469442573], length 364
22:54:04.208433 IP 147.182.158.9.22 > 142.187.29.131.52682: Flags [P.], seq 21976:22180, ack 1, win 501, options [nop,nop,TS val 2289563453 ecr 2469442573], length 204
22:54:04.208626 IP 147.182.158.9.22 > 142.187.29.131.52682: Flags [P.], seq 22180:22384, ack 1, win 501, options [nop,nop,TS val 2289563453 ecr 2469442573], length 204
22:54:04.208824 IP 147.182.158.9.22 > 142.187.29.131.52682: Flags [P.], seq 22384:22588, ack 1, win 501, options [nop,nop,TS val 2289563453 ecr 2469442573], length 204
22:54:04.209036 IP 147.182.158.9.22 > 142.187.29.131.52682: Flags [P.], seq 22588:22792, ack 1, win 501, options [nop,nop,TS val 2289563453 ecr 2469442573], length 204
22:54:04.209325 IP 147.182.158.9.22 > 142.187.29.131.52682: Flags [P.], seq 22792:22996, ack 1, win 501, options [nop,nop,TS val 2289563454 ecr 2469442573], length 204
22:54:04.209566 IP 147.182.158.9.22 > 142.187.29.131.52682: Flags [P.], seq 22996:23200, ack 1, win 501, options [nop,nop,TS val 2289563454 ecr 2469442573], length 204
22:54:04.209866 IP 147.182.158.9.22 > 142.187.29.131.52682: Flags [P.], seq 23200:23404, ack 1, win 501, options [nop,nop,TS val 2289563454 ecr 2469442573], length 204
22:54:04.210052 IP 147.182.158.9.22 > 142.187.29.131.52682: Flags [P.], seq 23404:23608, ack 1, win 501, options [nop,nop,TS val 2289563454 ecr 2469442573], length 204
22:54:04.210186 IP 147.182.158.9.22 > 142.187.29.131.52682: Flags [P.], seq 23608:23812, ack 1, win 501, options [nop,nop,TS val 2289563454 ecr 2469442573], length 204
22:54:04.210395 IP 147.182.158.9.22 > 142.187.29.131.52682: Flags [P.], seq 23812:24016, ack 1, win 501, options [nop,nop,TS val 2289563455 ecr 2469442573], length 204
22:54:04.210623 IP 147.182.158.9.22 > 142.187.29.131.52682: Flags [P.], seq 24016:24220, ack 1, win 501, options [nop,nop,TS val 2289563455 ecr 2469442573], length 204
22:54:04.210812 IP 147.182.158.9.22 > 142.187.29.131.52682: Flags [P.], seq 24220:24424, ack 1, win 501, options [nop,nop,TS val 2289563455 ecr 2469442573], length 204
22:54:04.211012 IP 147.182.158.9.22 > 142.187.29.131.52682: Flags [P.], seq 24424:24628, ack 1, win 501, options [nop,nop,TS val 2289563455 ecr 2469442573], length 204
22:54:04.211153 IP 147.182.158.9.22 > 142.187.29.131.52682: Flags [P.], seq 24628:24832, ack 1, win 501, options [nop,nop,TS val 2289563455 ecr 2469442573], length 204
22:54:04.211344 IP 147.182.158.9.22 > 142.187.29.131.52682: Flags [P.], seq 24832:25036, ack 1, win 501, options [nop,nop,TS val 2289563456 ecr 2469442573], length 204
22:54:04.211517 IP 147.182.158.9.22 > 142.187.29.131.52682: Flags [P.], seq 25036:25240, ack 1, win 501, options [nop,nop,TS val 2289563456 ecr 2469442573], length 204
22:54:04.211714 IP 147.182.158.9.22 > 142.187.29.131.52682: Flags [P.], seq 25240:25444, ack 1, win 501, options [nop,nop,TS val 2289563456 ecr 2469442573], length 204
22:54:04.211844 IP 147.182.158.9.22 > 142.187.29.131.52682: Flags [P.], seq 25444:25648, ack 1, win 501, options [nop,nop,TS val 2289563456 ecr 2469442573], length 204
22:54:04.218067 IP 142.187.29.131.52682 > 147.182.158.9.22: Flags [.], ack 15788, win 3545, options [nop,nop,TS val 2469442579 ecr 2289563428], length 0
22:54:04.218158 IP 147.182.158.9.22 > 142.187.29.131.52682: Flags [P.], seq 25648:25852, ack 1, win 501, options [nop,nop,TS val 2289563462 ecr 2469442579], length 204
22:54:04.218449 IP 147.182.158.9.22 > 142.187.29.131.52682: Flags [P.], seq 25852:26216, ack 1, win 501, options [nop,nop,TS val 2289563463 ecr 2469442579], length 364
22:54:04.218611 IP 147.182.158.9.22 > 142.187.29.131.52682: Flags [P.], seq 26216:26420, ack 1, win 501, options [nop,nop,TS val 2289563463 ecr 2469442579], length 204
22:54:04.218797 IP 147.182.158.9.22 > 142.187.29.131.52682: Flags [P.], seq 26420:26624, ack 1, win 501, options [nop,nop,TS val 2289563463 ecr 2469442579], length 204
22:54:04.219013 IP 147.182.158.9.22 > 142.187.29.131.52682: Flags [P.], seq 26624:26828, ack 1, win 501, options [nop,nop,TS val 2289563463 ecr 2469442579], length 204
22:54:04.219200 IP 147.182.158.9.22 > 142.187.29.131.52682: Flags [P.], seq 26828:27032, ack 1, win 501, options [nop,nop,TS val 2289563463 ecr 2469442579], length 204
22:54:04.219361 IP 147.182.158.9.22 > 142.187.29.131.52682: Flags [P.], seq 27032:27236, ack 1, win 501, options [nop,nop,TS val 2289563464 ecr 2469442579], length 204
22:54:04.219513 IP 147.182.158.9.22 > 142.187.29.131.52682: Flags [P.], seq 27236:27440, ack 1, win 501, options [nop,nop,TS val 2289563464 ecr 2469442579], length 204
22:54:04.219658 IP 147.182.158.9.22 > 142.187.29.131.52682: Flags [P.], seq 27440:27644, ack 1, win 501, options [nop,nop,TS val 2289563464 ecr 2469442579], length 204
22:54:04.219791 IP 147.182.158.9.22 > 142.187.29.131.52682: Flags [P.], seq 27644:27848, ack 1, win 501, options [nop,nop,TS val 2289563464 ecr 2469442579], length 204
22:54:04.219926 IP 147.182.158.9.22 > 142.187.29.131.52682: Flags [P.], seq 27848:28052, ack 1, win 501, options [nop,nop,TS val 2289563464 ecr 2469442579], length 204
22:54:04.220068 IP 147.182.158.9.22 > 142.187.29.131.52682: Flags [P.], seq 28052:28256, ack 1, win 501, options [nop,nop,TS val 2289563464 ecr 2469442579], length 204
22:54:04.220245 IP 147.182.158.9.22 > 142.187.29.131.52682: Flags [P.], seq 28256:28460, ack 1, win 501, options [nop,nop,TS val 2289563464 ecr 2469442579], length 204
22:54:04.220394 IP 147.182.158.9.22 > 142.187.29.131.52682: Flags [P.], seq 28460:28664, ack 1, win 501, options [nop,nop,TS val 2289563465 ecr 2469442579], length 204
22:54:04.220536 IP 147.182.158.9.22 > 142.187.29.131.52682: Flags [P.], seq 28664:28868, ack 1, win 501, options [nop,nop,TS val 2289563465 ecr 2469442579], length 204
22:54:04.220673 IP 147.182.158.9.22 > 142.187.29.131.52682: Flags [P.], seq 28868:29072, ack 1, win 501, options [nop,nop,TS val 2289563465 ecr 2469442579], length 204
22:54:04.220811 IP 147.182.158.9.22 > 142.187.29.131.52682: Flags [P.], seq 29072:29276, ack 1, win 501, options [nop,nop,TS val 2289563465 ecr 2469442579], length 204
22:54:04.220963 IP 147.182.158.9.22 > 142.187.29.131.52682: Flags [P.], seq 29276:29480, ack 1, win 501, options [nop,nop,TS val 2289563465 ecr 2469442579], length 204
22:54:04.221098 IP 147.182.158.9.22 > 142.187.29.131.52682: Flags [P.], seq 29480:29684, ack 1, win 501, options [nop,nop,TS val 2289563465 ecr 2469442579], length 204
22:54:04.221225 IP 147.182.158.9.22 > 142.187.29.131.52682: Flags [P.], seq 29684:29888, ack 1, win 501, options [nop,nop,TS val 2289563465 ecr 2469442579], length 204
22:54:04.221402 IP 147.182.158.9.22 > 142.187.29.131.52682: Flags [P.], seq 29888:30092, ack 1, win 501, options [nop,nop,TS val 2289563466 ecr 2469442579], length 204
22:54:04.221548 IP 147.182.158.9.22 > 142.187.29.131.52682: Flags [P.], seq 30092:30296, ack 1, win 501, options [nop,nop,TS val 2289563466 ecr 2469442579], length 204
22:54:04.221691 IP 147.182.158.9.22 > 142.187.29.131.52682: Flags [P.], seq 30296:30500, ack 1, win 501, options [nop,nop,TS val 2289563466 ecr 2469442579], length 204
22:54:04.221834 IP 147.182.158.9.22 > 142.187.29.131.52682: Flags [P.], seq 30500:30704, ack 1, win 501, options [nop,nop,TS val 2289563466 ecr 2469442579], length 204
22:54:04.222703 IP 142.187.29.131.52682 > 147.182.158.9.22: Flags [.], ack 16784, win 3545, options [nop,nop,TS val 2469442586 ecr 2289563433], length 0
22:54:04.222762 IP 147.182.158.9.22 > 142.187.29.131.52682: Flags [P.], seq 30704:30908, ack 1, win 501, options [nop,nop,TS val 2289563467 ecr 2469442586], length 204
22:54:04.223001 IP 147.182.158.9.22 > 142.187.29.131.52682: Flags [P.], seq 30908:31272, ack 1, win 501, options [nop,nop,TS val 2289563467 ecr 2469442586], length 364
22:54:04.223168 IP 147.182.158.9.22 > 142.187.29.131.52682: Flags [P.], seq 31272:31476, ack 1, win 501, options [nop,nop,TS val 2289563467 ecr 2469442586], length 204
22:54:04.223348 IP 147.182.158.9.22 > 142.187.29.131.52682: Flags [P.], seq 31476:31680, ack 1, win 501, options [nop,nop,TS val 2289563468 ecr 2469442586], length 204
22:54:04.223534 IP 147.182.158.9.22 > 142.187.29.131.52682: Flags [P.], seq 31680:31884, ack 1, win 501, options [nop,nop,TS val 2289563468 ecr 2469442586], length 204
22:54:04.223694 IP 147.182.158.9.22 > 142.187.29.131.52682: Flags [P.], seq 31884:32088, ack 1, win 501, options [nop,nop,TS val 2289563468 ecr 2469442586], length 204
22:54:04.223871 IP 147.182.158.9.22 > 142.187.29.131.52682: Flags [P.], seq 32088:32292, ack 1, win 501, options [nop,nop,TS val 2289563468 ecr 2469442586], length 204
22:54:04.224042 IP 147.182.158.9.22 > 142.187.29.131.52682: Flags [P.], seq 32292:32496, ack 1, win 501, options [nop,nop,TS val 2289563468 ecr 2469442586], length 204
22:54:04.224204 IP 147.182.158.9.22 > 142.187.29.131.52682: Flags [P.], seq 32496:32700, ack 1, win 501, options [nop,nop,TS val 2289563468 ecr 2469442586], length 204
22:54:04.224385 IP 147.182.158.9.22 > 142.187.29.131.52682: Flags [P.], seq 32700:32904, ack 1, win 501, options [nop,nop,TS val 2289563469 ecr 2469442586], length 204
22:54:04.224535 IP 147.182.158.9.22 > 142.187.29.131.52682: Flags [P.], seq 32904:33108, ack 1, win 501, options [nop,nop,TS val 2289563469 ecr 2469442586], length 204
22:54:04.224686 IP 147.182.158.9.22 > 142.187.29.131.52682: Flags [P.], seq 33108:33312, ack 1, win 501, options [nop,nop,TS val 2289563469 ecr 2469442586], length 204
22:54:04.224857 IP 147.182.158.9.22 > 142.187.29.131.52682: Flags [P.], seq 33312:33516, ack 1, win 501, options [nop,nop,TS val 2289563469 ecr 2469442586], length 204
22:54:04.225005 IP 147.182.158.9.22 > 142.187.29.131.52682: Flags [P.], seq 33516:33720, ack 1, win 501, options [nop,nop,TS val 2289563469 ecr 2469442586], length 204
22:54:04.225169 IP 147.182.158.9.22 > 142.187.29.131.52682: Flags [P.], seq 33720:33924, ack 1, win 501, options [nop,nop,TS val 2289563469 ecr 2469442586], length 204
22:54:04.225351 IP 147.182.158.9.22 > 142.187.29.131.52682: Flags [P.], seq 33924:34128, ack 1, win 501, options [nop,nop,TS val 2289563470 ecr 2469442586], length 204
22:54:04.225507 IP 147.182.158.9.22 > 142.187.29.131.52682: Flags [P.], seq 34128:34332, ack 1, win 501, options [nop,nop,TS val 2289563470 ecr 2469442586], length 204
22:54:04.225687 IP 147.182.158.9.22 > 142.187.29.131.52682: Flags [P.], seq 34332:34536, ack 1, win 501, options [nop,nop,TS val 2289563470 ecr 2469442586], length 204
22:54:04.227875 IP 142.187.29.131.52682 > 147.182.158.9.22: Flags [.], ack 19468, win 3545, options [nop,nop,TS val 2469442588 ecr 2289563434], length 0
22:54:04.227875 IP 142.187.29.131.52682 > 147.182.158.9.22: Flags [.], ack 20120, win 3545, options [nop,nop,TS val 2469442591 ecr 2289563442], length 0
22:54:04.227875 IP 142.187.29.131.52682 > 147.182.158.9.22: Flags [P.], seq 1:37, ack 19468, win 3545, options [nop,nop,TS val 2469442589 ecr 2289563434], length 36
22:54:04.227981 IP 147.182.158.9.22 > 142.187.29.131.52682: Flags [P.], seq 34536:34740, ack 1, win 501, options [nop,nop,TS val 2289563472 ecr 2469442588], length 204
22:54:04.228272 IP 147.182.158.9.22 > 142.187.29.131.52682: Flags [P.], seq 34740:35424, ack 37, win 501, options [nop,nop,TS val 2289563473 ecr 2469442589], length 684
22:54:04.228488 IP 147.182.158.9.22 > 142.187.29.131.52682: Flags [P.], seq 35424:35628, ack 37, win 501, options [nop,nop,TS val 2289563473 ecr 2469442589], length 204
22:54:04.228639 IP 147.182.158.9.22 > 142.187.29.131.52682: Flags [P.], seq 35628:35832, ack 37, win 501, options [nop,nop,TS val 2289563473 ecr 2469442589], length 204
22:54:04.228817 IP 147.182.158.9.22 > 142.187.29.131.52682: Flags [P.], seq 35832:36036, ack 37, win 501, options [nop,nop,TS val 2289563473 ecr 2469442589], length 204
22:54:04.229020 IP 147.182.158.9.22 > 142.187.29.131.52682: Flags [P.], seq 36036:36240, ack 37, win 501, options [nop,nop,TS val 2289563473 ecr 2469442589], length 204
22:54:04.229168 IP 147.182.158.9.22 > 142.187.29.131.52682: Flags [P.], seq 36240:36444, ack 37, win 501, options [nop,nop,TS val 2289563473 ecr 2469442589], length 204
22:54:04.229348 IP 147.182.158.9.22 > 142.187.29.131.52682: Flags [P.], seq 36444:36648, ack 37, win 501, options [nop,nop,TS val 2289563474 ecr 2469442589], length 204
22:54:04.229532 IP 147.182.158.9.22 > 142.187.29.131.52682: Flags [P.], seq 36648:36852, ack 37, win 501, options [nop,nop,TS val 2289563474 ecr 2469442589], length 204
22:54:04.229728 IP 147.182.158.9.22 > 142.187.29.131.52682: Flags [P.], seq 36852:37056, ack 37, win 501, options [nop,nop,TS val 2289563474 ecr 2469442589], length 204
22:54:04.229908 IP 147.182.158.9.22 > 142.187.29.131.52682: Flags [P.], seq 37056:37260, ack 37, win 501, options [nop,nop,TS val 2289563474 ecr 2469442589], length 204
22:54:04.230087 IP 147.182.158.9.22 > 142.187.29.131.52682: Flags [P.], seq 37260:37464, ack 37, win 501, options [nop,nop,TS val 2289563474 ecr 2469442589], length 204
22:54:04.230262 IP 147.182.158.9.22 > 142.187.29.131.52682: Flags [P.], seq 37464:37668, ack 37, win 501, options [nop,nop,TS val 2289563475 ecr 2469442589], length 204
22:54:04.230412 IP 147.182.158.9.22 > 142.187.29.131.52682: Flags [P.], seq 37668:37872, ack 37, win 501, options [nop,nop,TS val 2289563475 ecr 2469442589], length 204
22:54:04.230578 IP 147.182.158.9.22 > 142.187.29.131.52682: Flags [P.], seq 37872:38076, ack 37, win 501, options [nop,nop,TS val 2289563475 ecr 2469442589], length 204
22:54:04.230758 IP 147.182.158.9.22 > 142.187.29.131.52682: Flags [P.], seq 38076:38280, ack 37, win 501, options [nop,nop,TS val 2289563475 ecr 2469442589], length 204
22:54:04.230921 IP 147.182.158.9.22 > 142.187.29.131.52682: Flags [P.], seq 38280:38484, ack 37, win 501, options [nop,nop,TS val 2289563475 ecr 2469442589], length 204
22:54:04.231074 IP 147.182.158.9.22 > 142.187.29.131.52682: Flags [P.], seq 38484:38688, ack 37, win 501, options [nop,nop,TS val 2289563475 ecr 2469442589], length 204
22:54:04.233366 IP 142.187.29.131.52682 > 147.182.158.9.22: Flags [.], ack 21408, win 3545, options [nop,nop,TS val 2469442597 ecr 2289563449], length 0
22:54:04.233422 IP 147.182.158.9.22 > 142.187.29.131.52682: Flags [P.], seq 38688:38892, ack 37, win 501, options [nop,nop,TS val 2289563478 ecr 2469442597], length 204
22:54:04.233767 IP 147.182.158.9.22 > 142.187.29.131.52682: Flags [P.], seq 38892:39256, ack 37, win 501, options [nop,nop,TS val 2289563478 ecr 2469442597], length 364
22:54:04.233941 IP 147.182.158.9.22 > 142.187.29.131.52682: Flags [P.], seq 39256:39460, ack 37, win 501, options [nop,nop,TS val 2289563478 ecr 2469442597], length 204
22:54:04.234101 IP 147.182.158.9.22 > 142.187.29.131.52682: Flags [P.], seq 39460:39664, ack 37, win 501, options [nop,nop,TS val 2289563478 ecr 2469442597], length 204
22:54:04.234249 IP 147.182.158.9.22 > 142.187.29.131.52682: Flags [P.], seq 39664:39868, ack 37, win 501, options [nop,nop,TS val 2289563478 ecr 2469442597], length 204
22:54:04.234400 IP 147.182.158.9.22 > 142.187.29.131.52682: Flags [P.], seq 39868:40072, ack 37, win 501, options [nop,nop,TS val 2289563479 ecr 2469442597], length 204
22:54:04.234571 IP 147.182.158.9.22 > 142.187.29.131.52682: Flags [P.], seq 40072:40276, ack 37, win 501, options [nop,nop,TS val 2289563479 ecr 2469442597], length 204
22:54:04.234720 IP 147.182.158.9.22 > 142.187.29.131.52682: Flags [P.], seq 40276:40480, ack 37, win 501, options [nop,nop,TS val 2289563479 ecr 2469442597], length 204
22:54:04.235104 IP 142.187.29.131.52682 > 147.182.158.9.22: Flags [P.], seq 37:73, ack 21408, win 3545, options [nop,nop,TS val 2469442598 ecr 2289563449], length 36
^C
190 packets captured
190 packets received by filter
0 packets dropped by kernel